{
  "$schema": "./features.schema.json",
  "registryVersion": 1,
  "reasons": ["runtime", "outlet", "product", "dependency", "version"],
  "runtimes": [
    {
      "id": "node",
      "title": "Node (servers, CLIs, Electron main)"
    },
    {
      "id": "python",
      "title": "CPython"
    },
    {
      "id": "web",
      "title": "Browser (React SDK over client-core)"
    },
    {
      "id": "desktop-bridge",
      "title": "Desktop renderer over a host bridge"
    },
    {
      "id": "macos",
      "title": "macOS"
    },
    {
      "id": "ios",
      "title": "iOS and iPadOS"
    },
    {
      "id": "windows",
      "title": "Windows"
    },
    {
      "id": "linux",
      "title": "Linux"
    },
    {
      "id": "android",
      "title": "Android"
    },
    {
      "id": "jvm",
      "title": "JVM desktop"
    },
    {
      "id": "dotnet",
      "title": ".NET desktop"
    },
    {
      "id": "unity",
      "title": "Unity"
    },
    {
      "id": "tauri",
      "title": "Tauri webview"
    }
  ],
  "traits": [
    {
      "id": "headless",
      "title": "Headless SDK: ships no widget kit; its UI expectation is ui.cli (Node, Python)"
    }
  ],
  "families": [
    {
      "id": "core",
      "title": "Core"
    },
    {
      "id": "license",
      "title": "License"
    },
    {
      "id": "config",
      "title": "Config"
    },
    {
      "id": "sync",
      "title": "Cloud Sync"
    },
    {
      "id": "connect",
      "title": "Cloud Connect"
    },
    {
      "id": "devices",
      "title": "Devices and identity"
    },
    {
      "id": "release",
      "title": "Release and update"
    },
    {
      "id": "packs",
      "title": "Packs"
    },
    {
      "id": "ui",
      "title": "UI and commerce"
    },
    {
      "id": "server",
      "title": "Servers"
    }
  ],
  "sdks": [
    {
      "id": "node",
      "title": "Node",
      "manifest": "packages/sdk-node/parity.json",
      "constants": "packages/sdk-node/src/constants.generated.ts"
    },
    {
      "id": "react",
      "title": "React",
      "manifest": "packages/sdk-react/parity.json",
      "constants": "packages/ui-core/src/browser/sdk/constants.generated.ts"
    },
    {
      "id": "python",
      "title": "Python",
      "manifest": "sdks/python/parity.json",
      "constants": "sdks/python/src/polaris_key/constants_generated.py"
    },
    {
      "id": "swift",
      "title": "Swift",
      "manifest": "sdks/swift/parity.json",
      "constants": "sdks/swift/Sources/PolarisKeyCore/Constants.generated.swift"
    },
    {
      "id": "godot",
      "title": "Godot",
      "manifest": "sdks/godot/parity.json",
      "constants": "sdks/godot/addons/polaris_key/core/constants_generated.gd"
    },
    {
      "id": "kotlin",
      "title": "Kotlin",
      "manifest": "sdks/kotlin/parity.json",
      "constants": "sdks/kotlin/core/src/main/kotlin/im/plrs/key/core/Constants.generated.kt"
    }
  ],
  "features": [
    {
      "id": "core.verify",
      "family": "core",
      "title": "JWS verify, trust manifest (pinning, rotation), clock floor",
      "service": "core",
      "proof": [
        {
          "kind": "corpus",
          "file": "cases.json"
        }
      ],
      "allowedNa": []
    },
    {
      "id": "core.cache",
      "family": "core",
      "title": "Verified cache; construct and load offline",
      "service": "core",
      "proof": [
        {
          "kind": "transcript"
        },
        {
          "kind": "unit"
        }
      ],
      "allowedNa": []
    },
    {
      "id": "core.bundle",
      "family": "core",
      "title": "Offline bundle import",
      "service": "core",
      "proof": [
        {
          "kind": "corpus",
          "file": "cases.json",
          "family": "bundleCases"
        }
      ],
      "allowedNa": []
    },
    {
      "id": "core.discover",
      "family": "core",
      "title": "Discovery and capabilities, fail-closed",
      "service": "core",
      "proof": [
        {
          "kind": "transcript"
        }
      ],
      "allowedNa": []
    },
    {
      "id": "core.presentation",
      "family": "core",
      "service": "core",
      "title": "Product presentation from discovery: name, developer, accent, verified icon",
      "proof": [
        {
          "kind": "transcript"
        },
        {
          "kind": "corpus",
          "file": "presentation-matrix.json"
        }
      ],
      "allowedNa": []
    },
    {
      "id": "core.sync",
      "family": "core",
      "title": "Sync, ETag/304, backoff, refresh loop, change events",
      "service": "core",
      "proof": [
        {
          "kind": "transcript"
        }
      ],
      "allowedNa": []
    },
    {
      "id": "core.local",
      "family": "core",
      "title": "Local-only client (no network)",
      "service": "core",
      "proof": [
        {
          "kind": "unit"
        }
      ],
      "allowedNa": []
    },
    {
      "id": "core.headers",
      "family": "core",
      "title": "Canonical platform, arch and SDK header values",
      "service": "core",
      "proof": [
        {
          "kind": "corpus",
          "file": "headers.json",
          "wp": "P1b-04"
        }
      ],
      "allowedNa": []
    },
    {
      "id": "core.errors",
      "family": "core",
      "title": "Shared error codes",
      "service": "core",
      "proof": [
        {
          "kind": "generated",
          "command": "pnpm gen constants --check",
          "wp": "P1b-02"
        }
      ],
      "allowedNa": []
    },
    {
      "id": "core.caps",
      "family": "core",
      "title": "supports() and capability telemetry",
      "service": "core",
      "proof": [
        {
          "kind": "unit"
        }
      ],
      "allowedNa": [],
      "note": "Also proven by the parity gate: the capability table supports() reads is generated from the SDK's manifest into its constants module, and parity:check fails when the module's CAPABILITY_DIGEST is not the manifest's (P1b-10)."
    },
    {
      "id": "core.store",
      "family": "core",
      "title": "Secure token store, surfaced failure, no silent downgrade",
      "service": "core",
      "proof": [
        {
          "kind": "unit"
        }
      ],
      "allowedNa": [
        {
          "runtime": "web",
          "reason": "runtime",
          "why": "A browser has no keyring; the session lives in an HttpOnly cookie."
        },
        {
          "runtime": "desktop-bridge",
          "reason": "runtime",
          "why": "The renderer holds no credentials; the host process's Node SDK keeps the token behind the bridge (packages/sdk-react/src/desktop/bridge.ts)."
        },
        {
          "runtime": "node",
          "reason": "dependency",
          "why": "The OS keyring is reached through the optional @napi-rs/keyring addon, which cannot load inside a single-executable build or without a Secret Service; the token then lives in a 0600 file, Store.status() says keyring-unavailable and supports() says dependency (P1b-10)."
        },
        {
          "runtime": "python",
          "reason": "dependency",
          "why": "The keyring backend is the optional `polaris-key[keyring]` extra; without it, or without a usable OS keyring, the token lives in a 0600 file, Store.status() says keyring-unavailable and supports() says dependency (P1b-10)."
        },
        {
          "runtime": "jvm",
          "reason": "dependency",
          "why": "A JVM desktop process reaches no OS keyring (Keychain, Credential Manager, Secret Service) without a native library, which the Kotlin SDK does not ship; the token lives in a 0600 file, Store.status() says keyring-unavailable and supports() says dependency (P6-06). Android has the Keystore (P6-12)."
        }
      ]
    },
    {
      "id": "core.copy",
      "family": "core",
      "title": "Error, gate and activation copy: copy.message(code), copy.title(code)",
      "service": "sdk",
      "proof": [
        {
          "kind": "generated",
          "command": "pnpm gen constants --check"
        },
        {
          "kind": "unit"
        }
      ],
      "allowedNa": [],
      "note": "The English base is conformance/parity/copy.en.json (copy.schema.json); gen constants emits one generated copy module per SDK and refuses a key set that does not cover every errors.json code, every licenseStatus and every activationResult. The unit proof is each SDK's fallback and placeholder table (SDK-PARITY-PASS §3.2)."
    },
    {
      "id": "core.backend",
      "family": "core",
      "title": "The client half: X-PKey-License to the app's own backend, refresh first and retry once (client.backend)",
      "service": "license",
      "proof": [
        {
          "kind": "corpus",
          "file": "backend-matrix.json",
          "family": "client",
          "wp": "SP-53"
        }
      ],
      "allowedNa": [],
      "note": "WIRE-CONTRACT-V4 §14.5: backend-matrix.json's `client` section; client-core's `clientBackendAction` is the reference (SP-53). Never sends the device token or the config document."
    },
    {
      "id": "license.gate",
      "family": "license",
      "title": "Gate evaluation, every status",
      "service": "license",
      "proof": [
        {
          "kind": "corpus",
          "file": "gate-matrix.json"
        }
      ],
      "allowedNa": []
    },
    {
      "id": "license.signedinuser",
      "family": "license",
      "title": "Signed-in user: profile.user.subject read beside the claims",
      "service": "license",
      "proof": [
        {
          "kind": "corpus",
          "file": "cases.json",
          "family": "licenseUserCases",
          "wp": "SP-54"
        }
      ],
      "allowedNa": [],